{
  "$schema": "../schemas/marketplace.schema.json",
  "name": "defra-ai-plugins",
  "description": "Defra GitHub Copilot CLI plugins — agents and skills that encode Defra software development standards and GDS service standards.",
  "version": "0.1.0",
  "owner": {
    "type": "organization",
    "name": "DEFRA"
  },
  "plugins": [
    {
      "name": "defra-pii-redaction",
      "description": "Intercepts all LLM interactions — prompts, tool inputs, and tool outputs — and redacts UK PII before data reaches or leaves the model, using a configurable Python redaction script.",
      "version": "0.1.0",
      "source": "./plugins/defra-pii-redaction"
    },
    {
      "name": "defra-shared",
      "description": "Cross-cutting Defra standards as installable skills and guardrail hooks: branching, commit messages, code-quality gates, security & PII handling, and accessibility. Referenced by every other Defra plugin so cross-cutting standards live in one place. No agent — skills + hooks only.",
      "version": "0.1.0",
      "source": "./plugins/defra-shared"
    },
    {
      "name": "frontend-developer",
      "description": "Builds Defra-compliant frontends following the GOV.UK Design System, WCAG 2.2 AA, and Defra software development standards (Hapi + Nunjucks + SCSS + Vitest).",
      "version": "0.1.0",
      "source": "./plugins/frontend-developer"
    },
    {
      "name": "gds-design-system",
      "description": "GOV.UK Design System depth for agents building user journeys. Every component, pattern and style from the Design System, with the full Nunjucks macro API, as offline reference files — so agents stop reading node_modules for template code and start following the guidance on how components are meant to be used. Includes GOV.UK Prototype Kit plumbing and end-to-end journey assembly. Skills and a guard hook, no agent.",
      "version": "0.1.0",
      "source": "./plugins/gds-design-system"
    },
    {
      "name": "ticket-writer",
      "description": "Creates well-structured JIRA tickets (stories and tasks) for any team. Ships default templates for user-facing stories and technical tasks, with support for custom templates at runtime.",
      "version": "0.1.0",
      "source": "./plugins/ticket-writer"
    },
    {
      "name": "user-centred-designer",
      "description": "User-centred design skills for Defra: service blueprints and journey maps, document and presentation standards (GOV.UK content design, Defra visual standards), and interaction and content design for CDP frontends. No agent, skills only, built from the AI Capability and Enablement team's delivery work.",
      "version": "0.1.0",
      "source": "./plugins/user-centred-designer"
    }
  ]
}
